<?xml version="1.0"?>
<!DOCTYPE palette PUBLIC "-//ilixi//DTD Palette v2//EN" "http://www.ilixi.org/dtd/palette.dtd">
<palette>
	<application>
		<bg>
			<color>
				<hex>666666</hex>
			</color>
		</bg>
		<focus>
			<color>
				<hex>577E04</hex>
			</color>
		</focus>
		<text>
			<color>
				<hex>333333</hex>
			</color>
		</text>
		<textDisabled>
			<color>
				<hex>747474</hex>
			</color>
		</textDisabled>
	</application>
	<default>
		<base>
			<color>
				<hex>FFFFFF</hex>
			</color>
		</base>
		<baseText>
			<color>
				<hex>000000</hex>
			</color>
		</baseText>
		<baseAlt>
			<color>
				<hex>E0E0E0</hex>
			</color>
		</baseAlt>
		<baseAltText>
			<color>
				<hex>000000</hex>
			</color>
		</baseAltText>
		<bg>
			<color>
				<hex>474747</hex>
			</color>
		</bg>
		<border>
			<color>
				<hex>141414</hex>
			</color>
		</border>
		<fill>
			<color>
				<hex>375C86</hex>
			</color>
		</fill>
		<text>
			<color>
				<hex>333333</hex>
			</color>
		</text>
	</default>
	<disabled>
		<base>
			<color>
				<hex>515151</hex>
			</color>
		</base>
		<baseText>
			<color>
				<hex>1A1A1A</hex>
			</color>
		</baseText>
		<baseAlt>
			<color>
				<hex>323232</hex>
			</color>
		</baseAlt>
		<baseAltText>
			<color>
				<hex>515151</hex>
			</color>
		</baseAltText>
		<bg>
			<color>
				<hex>4B4B4B</hex>
			</color>
		</bg>
		<border>
			<color>
				<hex>303030</hex>
			</color>
		</border>
		<fill>
			<color>
				<hex>45505D</hex>
			</color>
		</fill>
		<text>
			<color>
				<hex>747474</hex>
			</color>
		</text>
	</disabled>
	<exposed>
		<base>
			<color>
				<hex>FFFFFF</hex>
			</color>
		</base>
		<baseText>
			<color>
				<hex>000000</hex>
			</color>
		</baseText>
		<baseAlt>
			<color>
				<hex>E0E0E0</hex>
			</color>
		</baseAlt>
		<baseAltText>
			<color>
				<hex>000000</hex>
			</color>
		</baseAltText>
		<bg>
			<color>
				<hex>545454</hex>
			</color>
		</bg>
		<border>
			<color>
				<hex>000000</hex>
			</color>
		</border>
		<fill>
			<color>
				<hex>375C86</hex>
			</color>
		</fill>
		<text>
			<color>
				<hex>333333</hex>
			</color>
		</text>
	</exposed>
	<pressed>
		<base>
			<color>
				<hex>FFFFFF</hex>
			</color>
		</base>
		<baseText>
			<color>
				<hex>000000</hex>
			</color>
		</baseText>
		<baseAlt>
			<color>
				<hex>E0E0E0</hex>
			</color>
		</baseAlt>
		<baseAltText>
			<color>
				<hex>000000</hex>
			</color>
		</baseAltText>
		<bg>
			<color>
				<hex>626262</hex>
			</color>
		</bg>
		<border>
			<color>
				<hex>000000</hex>
			</color>
		</border>
		<fill>
			<color>
				<hex>375C86</hex>
			</color>
		</fill>
		<text>
			<color>
				<hex>000000</hex>
			</color>
		</text>
	</pressed>
</palette>
