<?xml version="1.0"?>
<!--
<!DOCTYPE palette SYSTEM "http://www.ilixi.org/palette.dtd">
-->
<!DOCTYPE palette SYSTEM "palette.dtd">
<palette>
      <application>
            <bgBottom>
                  <color alpha="155">
                        <hex>000000</hex>
                  </color>
            </bgBottom>
            <bgMid>
                  <color>
                        <hex>000000</hex>
                  </color>
            </bgMid>
            <bgTop>
                  <color alpha="128">
                        <hex>141414</hex>
                  </color>
            </bgTop>
            <focusBottom>
                  <color>
                        <hex>FF6633</hex>
                  </color>
            </focusBottom>
            <focusMid>
                  <color>
                        <hex>FFFFFF</hex>
                  </color>
            </focusMid>
            <focusTop>
                  <color>
                        <hex>5196FF</hex>
                  </color>
            </focusTop>
            <text>
                  <color>
                        <hex>FFFFFF</hex>
                  </color>
            </text>
            <textDisabled>
                  <color>
                        <hex>747474</hex>
                  </color>
            </textDisabled>
      </application>
      <default>
            <base>
                  <color>
                        <hex>FFFFFF</hex>
                  </color>
            </base>
            <baseText>
                  <color>
                        <hex>000000</hex>
                  </color>
            </baseText>
            <baseAlt>
                  <color>
                        <hex>E0E0E0</hex>
                  </color>
            </baseAlt>
            <baseAltText>
                  <color>
                        <hex>000000</hex>
                  </color>
            </baseAltText>
            <bgBottom>
                  <color>
                        <hex>474747</hex>
                  </color>
            </bgBottom>
            <bgMid>
                  <color>
                        <hex>FFFFFF</hex>
                  </color>
            </bgMid>
            <bgTop>
                  <color>
                        <hex>686868</hex>
                  </color>
            </bgTop>
            <borderBottom>
                  <color>
                        <hex>141414</hex>
                  </color>
            </borderBottom>
            <borderMid>
                  <color>
                        <hex>717171</hex>
                  </color>
            </borderMid>
            <borderTop>
                  <color>
                        <hex>686868</hex>
                  </color>
            </borderTop>
            <fillBottom>
                  <color>
                        <hex>375C86</hex>
                  </color>
            </fillBottom>
            <fillMid>
                  <color>
                        <hex>5286B9</hex>
                  </color>
            </fillMid>
            <fillTop>
                  <color>
                        <hex>65A2E1</hex>
                  </color>
            </fillTop>
            <text>
                  <color>
                        <hex>FFFFFF</hex>
                  </color>
            </text>
      </default>
      <disabled>
            <base>
                  <color>
                        <hex>515151</hex>
                  </color>
            </base>
            <baseText>
                  <color>
                        <hex>1A1A1A</hex>
                  </color>
            </baseText>
            <baseAlt>
                  <color>
                        <hex>323232</hex>
                  </color>
            </baseAlt>
            <baseAltText>
                  <color>
                        <hex>515151</hex>
                  </color>
            </baseAltText>
            <bgBottom>
                  <color>
                        <hex>4B4B4B</hex>
                  </color>
            </bgBottom>
            <bgMid>
                  <color>
                        <hex>747474</hex>
                  </color>
            </bgMid>
            <bgTop>
                  <color>
                        <hex>424242</hex>
                  </color>
            </bgTop>
            <borderBottom>
                  <color>
                        <hex>303030</hex>
                  </color>
            </borderBottom>
            <borderMid>
                  <color>
                        <hex>565656</hex>
                  </color>
            </borderMid>
            <borderTop>
                  <color>
                        <hex>303030</hex>
                  </color>
            </borderTop>
            <fillBottom>
                  <color>
                        <hex>45505D</hex>
                  </color>
            </fillBottom>
            <fillMid>
                  <color>
                        <hex>3A5A69</hex>
                  </color>
            </fillMid>
            <fillTop>
                  <color>
                        <hex>4D5F72</hex>
                  </color>
            </fillTop>
            <text>
                  <color>
                        <hex>747474</hex>
                  </color>
            </text>
      </disabled>
      <exposed>
            <base>
                  <color>
                        <hex>FFFFFF</hex>
                  </color>
            </base>
            <baseText>
                  <color>
                        <hex>000000</hex>
                  </color>
            </baseText>
            <baseAlt>
                  <color>
                        <hex>E0E0E0</hex>
                  </color>
            </baseAlt>
            <baseAltText>
                  <color>
                        <hex>000000</hex>
                  </color>
            </baseAltText>
            <bgBottom>
                  <color>
                        <hex>545454</hex>
                  </color>
            </bgBottom>
            <bgMid>
                  <color>
                        <hex>FFFFFF</hex>
                  </color>
            </bgMid>
            <bgTop>
                  <color>
                        <hex>767676</hex>
                  </color>
            </bgTop>
            <borderBottom>
                  <color>
                        <hex>000000</hex>
                  </color>
            </borderBottom>
            <borderMid>
                  <color>
                        <hex>969696</hex>
                  </color>
            </borderMid>
            <borderTop>
                  <color>
                        <hex>515151</hex>
                  </color>
            </borderTop>
            <fillBottom>
                  <color>
                        <hex>375C86</hex>
                  </color>
            </fillBottom>
            <fillMid>
                  <color>
                        <hex>5286B9</hex>
                  </color>
            </fillMid>
            <fillTop>
                  <color>
                        <hex>65A2E1</hex>
                  </color>
            </fillTop>
            <text>
                  <color>
                        <hex>FFFFFF</hex>
                  </color>
            </text>
      </exposed>
      <pressed>
            <base>
                  <color>
                        <hex>FFFFFF</hex>
                  </color>
            </base>
            <baseText>
                  <color>
                        <hex>000000</hex>
                  </color>
            </baseText>
            <baseAlt>
                  <color>
                        <hex>E0E0E0</hex>
                  </color>
            </baseAlt>
            <baseAltText>
                  <color>
                        <hex>000000</hex>
                  </color>
            </baseAltText>
            <bgBottom>
                  <color>
                        <hex>626262</hex>
                  </color>
            </bgBottom>
            <bgMid>
                  <color>
                        <hex>FFFFFF</hex>
                  </color>
            </bgMid>
            <bgTop>
                  <color>
                        <hex>414141</hex>
                  </color>
            </bgTop>
            <borderBottom>
                  <color>
                        <hex>000000</hex>
                  </color>
            </borderBottom>
            <borderMid>
                  <color>
                        <hex>808080</hex>
                  </color>
            </borderMid>
            <borderTop>
                  <color>
                        <hex>323232</hex>
                  </color>
            </borderTop>
            <fillBottom>
                  <color>
                        <hex>375C86</hex>
                  </color>
            </fillBottom>
            <fillMid>
                  <color>
                        <hex>5286B9</hex>
                  </color>
            </fillMid>
            <fillTop>
                  <color>
                        <hex>65A2E1</hex>
                  </color>
            </fillTop>
            <text>
                  <color>
                        <hex>F0F0F0</hex>
                  </color>
            </text>
      </pressed>
</palette>
